train_id	name	item_condition_id	category_name	brand_name	price	shipping	item_description
479	Women's Converse All Star tennis shoes 7	3	Women/Shoes/Fashion Sneakers	Converse	18.0	0	"Women's Converse all star tennis shoes. Size: 7.... I think they run more like a 7.5. Bottom of shoe is 10.5"" from very tip to end of heel. Good condition.... Mild dirty on white sole and a toe scuff on left front."
480	BAMBOO ADULT TOOTHBRUSH 2-PACK	1	Other/Daily & Travel items/Personal Care		15.0	1	Brush with Bamboo’s 2-pack includes 2 Adult toothbrushes. Every part of this product is plant-based: bristles, handle, wrapper, and box. Soft bristles are made from a base of 62% castor bean oil (bio-based and recyclable, but not biodegradable). Bristles made in USA. The handle is made from 100% bamboo (organic and wild – no pesticides or fertilizers). The wrapper around the toothbrush is plant-based and commercially compostable. The box encasing the toothbrush is made from paper – no tape or glue is used. Your bamboo toothbrushes can be used for just as long as plastic toothbrushes. USDA Certified Biobased. Green American Certified. Vegan. BPA-Free. Natural and Non-toxic.
481	Blue Ombré Sequined Homecoming Dress	2	Women/Dresses/Knee-Length	Masquerade	36.0	0	Masquerade brand. Size 15/16. Perfect condition. Only worn once for a few hours
482	Peanut Butter Air Force One	2	Men/Shoes/Fashion Sneakers	Nike	61.0	0	Very clean . Worn maybe once. Has crease protection pads installed . Size 10.5 . Mint condition Not for sale in the main market anymore
483	UCLA sweatshirt - youth	2	Kids/Boys (4+)/Top & T-shirts		15.0	0	"•UCLA Sweatshirt• ▪️Youth size Small ▪️Unisex - perfect for boys or girls ▪️Super soft pullover sweatshirt with hood ▪️Signature UCLA blue and yellow ▪️50% Cotton 50% Polyester ▪️Chest measures 19"" straight across laid flat ▪️Length is 21"" long"
484	Maybelline Mascara #130 Blackest Black	1	Beauty/Makeup/Eyes	Maybelline	9.0	1	(3) maybelline mascara As pictured New!!! FAST FREE SHIPPING!!! Price is for all 3!!!
485	Jordan Toddler 5c	2	Kids/Boys 2T-5T/Shoes	Nike	20.0	1	Jordan Toddler 5c White Boy/Girl
486	Patagonia Tan Vest	2	Women/Coats & Jackets/Vest	patagonia	60.0	1	Incredibly warm vest, it's thick but light at the same time. I bought it large because that vest style runs small so it truly fits as a medium/large
487	Lularoe tc pink camera leggings	1	Women/Athletic Apparel/Pants, Tights, Leggings		60.0	1	Brand new floral camera leggings
488	LA Girl Banana Yellow Setting Powder	1	Beauty/Makeup/Face		8.0	1	"LA Girl HD Pro Setting Powder in Banana Yellow - Brand New *Comes without seal by manufacturer* *Quality assured - we source direct* • For all skin types and tones • Sets foundation and mattifies skin • Corrects redness • Neutralizes dark undertones • Can be applied on bare skin or over foundation ✨PLEASE READ BELOW ✔You'll receive everything as described or as shown in the photos ✅Handling time is 1 or 2 days (this is what ""ships within"" means) and transit time is 3 to 7 days EXcluding Sundays via USPS ✨BUNDLE FOR DISCOUNTS ✔Take [rm] off 2 items, [rm] off 3 items, [rm] off 4 items etc. ✔Each item is equal to each listing (which may consist of more than 1 product) ❌Our prices are otherwise firm ❤Check out our page! We have maybelline, loreal, nyx, beauty treats, city color, la girl, beauty creations, italia deluxe, contour highlighters, palettes, liquid lipstick etc"
489	Adidas men's gray athletic top medium	2	Men/Athletic Apparel/Shirts & Tops	Adidas	18.0	0	Like new, size medium
490	Lena Cosmetics Jason liquid lipstick	1	Beauty/Makeup/Lips		14.0	0	Brand new in box Lena Lashes Cosmetics liquid lipstick in Jason. Currently sold out. Perfect color/vampy color. Dark red/burgundy red. Beautiful color on any skin color.
491	Marvel legends Captain America	1	Kids/Toys/Action Figures & Statues	Marvel	19.0	0	Brand new
492	5 Disney Princess Dress Up	3	Kids/Toys/Dolls & Accessories	Disney	18.0	0	5 Disney Princess magnetic dress up Sleeping Beauty - Aurora Frozen - Elsa & Anna Disney Jr - Doc McStuffins Cinderella Lots of dress up options. Clothes shoes accessories Comes with Frozen keepsake box:) No free shipping
493	Call Of Duty Black Ops 3 PS4	3	Electronics/Video Games & Consoles/Games		12.0	0	No description yet
494	Caroline Pollack Necklace	2	Women/Jewelry/Necklaces		29.0	0	"925 SS 10 strand Necklace Called ""Liquid Silver"". Same one on eBay selling for [rm]. Price firm."
495	Columbia Down Jacket	3	Women/Athletic Apparel/Jackets	Columbia	34.0	0	Women's Cobalt blue down jacket. Gently Used. Very warm and snuggly on those cold mornings! Generous size large.
496	Women's latch belt	3	Women/Women's Accessories/Belts		6.0	1	FREE SHIPPING Will bundle Belt is stretchy..one size fits most
497	Nintendo 64 Men's T shirt Size 2XL	1	Men/Tops/T-shirts	Nintendo	15.0	1	New t shirt Official Licensed Product Size 2XL
498	Anastasia lipgloss - sepia	2	Beauty/Makeup/Lips	Sephora	12.0	0	Brand new, unsealed Anastasia opaque lip gloss. Opened to swatch, the color didn't look right with my skin tone. Retail is [rm]. I also have in Dusty Rose. Bundle for free shipping! Just ask in the comments below :) thanks for looking!
499	Lush	2	Beauty/Bath & Body/Bath		16.0	1	No description yet
500	Bundle for Elle's boutique	1	Women/Women's Accessories/Hats	PINK	49.0	1	Brand new Price is firm Bundle orders to save on shipping :)
501	New Tarte Mini Sample set	1	Beauty/Makeup/Face	Tarte	9.0	1	New Tarte Mini Sample set
502	NEW IN BOX Belkin iPhone/iPad chargers!	1	Electronics/Cell Phones & Accessories/Cell Phone Accessories	Belkin	15.0	1	These are 25$ in bell and other stores I got them at a salvage auction where the box they were in was damaged during shipping. 15$ each or 2 for 25. Shipping is free thanks!
503	Strappy Tangerine/Orange Monokini	2	Women/Swimwear/One-Piece		10.0	0	"I ordered this last year but I don't recall where from, nor is there a tag on it but it fits like a medium/large. Fits better on those who have some hips to them! Somewhat cheeky. Never wore in water, only to try on. It was a bit small and I should have gotten and XL. I am 5'4"" and about 180"
504	PINK summer tank	2	Women/Tops & Blouses/Tank, Cami	PINK	8.0	1	Good condition, worn maybe twice!
505	Banana Republic polo	2	Men/Tops/Polo, Rugby	Banana Republic	11.0	0	Navy and gray striped polo by Banana Republic luxury touch line of men's polo shirts. Size large. Very nice and soft polo with no signs of ware. Like new condition. Made with 100% cotton.
506	Brandy Melville holo sticker bundle	1	Women/Tops & Blouses/T-Shirts	Brandy Melville	3.0	1	Brandy Melville stickers ✨ holo alien sticker ✨ holo smile sticker FREE SHIPPING || Will be shipped in an envelope w/tracking provided
507	3D Mink False Eyelashes w Glue	1	Beauty/Makeup/Eyes		12.0	1	♡BNIB 2 Reusable pairs ♡ Includes 1 new DUO clear eyelash glue ♡Unbranded, Mink fibers ♡Check my ratings for feedback! ♡Prices are •FIRM• unless bundled ♡Check out my other lashes! ♡I ship within 2-3 business days MST. ♡Excludes holidays/weekends Tags for views: house of lashes, velour, mink, false lashes, false eyelashes, wispies, huda, kiss lashes, ardell, Kylie, makeup, cruelty free, koko lashes,
508	Like new Nike shorts!	2	Women/Athletic Apparel/Shorts	Nike	34.0	0	Green like new Nike shorts! Great condition! Excellent for a jog or a bum day! Offers are accepted! 3 pairs
509	✨Girl's fur vest ✨size medium	1	Kids/Girls (4+)/Tops & T-Shirts		13.0	0	✨NEW-Paid [rm] So cute with leggings! ✨Search jkids and bundle for best DEALS!!✨ Children's Place Gap Old Navy Justice
510	Nike Air Max Tavas	3	Men/Shoes/Fashion Sneakers	Nike	14.0	1	Sunset orange and red good condtion
511	Anastasia Beverly Hills That Glow	1	Beauty/Makeup/Makeup Palettes		15.0	1	Up for sale is a brand new Anastasia Beverly Hills glow kit! Brings instant luminosity to the complexion with these four metallic powder highlighters. Just layer the highly blendable shades together or wear them separately on the eyes and body for a radiant look. Good luck shoppers :)
512	Pink(Victoria Secret) Small w/ phone cas	1	Women/Tops & Blouses/T-Shirts	PINK	31.0	0	NWT...... Victoria Secret Gray&White Shirt..w/ IPHONE 7 plus case
513	Forever Red fragrance Mist	2	Beauty/Fragrance/Women	Bath & Body Works	15.0	1	NEVER used bath and body works forever red mist 8 fl oz
514	RAIDERS ZIP UP HOODIE	2	Women/Sweaters/Full Zip		16.0	1	Worn a couple of times but is still in brand-new condition please feel free to contact me with any questions or concerns thank you
515	Burgandy snow flake leggings OS	1	Women/Athletic Apparel/Pants, Tights, Leggings		51.0	0	One size fits small-large. Soft brush knit leggings are amazingly comfortable! 92 % polyester, 8 % spandex. Softer than LuLaRoe leggings! Not sheer or see through. Perfect for the winter or holidays! NOT LULAROE!! Burgundy asymmetrical top also available. Make it an outfit for 45! (White cardigan not included) Brand- Infinity Raine
516	First Remi and Indian Remi Virgin Hair	1	Beauty/Hair Care/Styling Products		55.0	1	"3 Packs of hair 2 Straight and 1 Wavy The straight is in 12 inch and Color is black The wavy hair is 16"" and Black Contact me before buying !!!"
517	Super Awesome Bundle	3	Other/Other/Other		49.0	0	This awesome bundle includes the red and white polka dot dress, the black and blue striped skirt, the pink speckled cardi, the cali jacket, the black strapless dress, and the plum adidas jacket. Also for free I'm including the black and gray cardigan, the black strappy bralette (perfect for summer!) and a pair of frameless heart shaped sunnies (not pictured)!! If the package wasn't already super full I'd include more items! Thank you so much for your business!
518	Tide Pods bundle	1	Home/Cleaning Supplies/Household Cleaners		18.0	0	Includes: 4 bags tide Pods spring meadow 14 pacs each bag total of 56 pacs
519	☆VS☆ 36dd DREAM ANGELS PUSHUP	3	Women/Underwear/Bras	Victoria's Secret	20.0	0	♡36dd VICTORIA'S SECRET DREAM ANGELS WITH CRYSTALS BRA ♡Baby blue lace with accent neon yellow spaghetti strap with accent bows ♡GOOD USED CONDITION
520	Lularoe Julia/Jordan Athletic Pant	2	Women/Dresses/Knee-Length	LuLaRoe	46.0	0	I love this print!! I believe it was called cabbage floral. It is red with pink,green and hints of yellow.
521	Boots	3	Men/Shoes/Boots	Timberland	74.0	0	Black timberland boots Size 7 boys/men
522	PIXAR *Cars*Blanket *free ship*	3	Home/Bedding/Blankets & Throws	Disney	9.0	1	Measures 33×44.
523	New lularoe Randy shirt sz m	1	Women/Tops & Blouses/T-Shirts	LuLaRoe	23.0	0	Comes from a smoke free pet friendly home check out my other listings to combined on shipping
524	Navy Blue Sweater	3	Kids/Boys 2T-5T/Coats & Jackets		7.0	1	No description yet
525	Elf Belle Beauty Book	1	Beauty/Makeup/Makeup Sets	e.l.f.	22.0	1	Brand new never used
526	Ballerina Doll	1	Kids/Toys/Dolls & Accessories	American Boy & Girl	15.0	0	Cute Blonde Ballerina Doll! Hardly used and very cute! There is no imperfections or flaws of any kind. I can not place her shoes so item comes with no shoes. Items comes with outfit and everything you see in photo. Her eyes close when she is down and open when up! American Girl Doll
527	Cam Matthew HOLD FOR FELDER	1	Vintage & Collectibles/Trading Cards/Sports	NFL	5.0	1	No description yet
528	Yu Darvish '16 Platinum Ice Card Rangers	2	Vintage & Collectibles/Trading Cards/Sports		3.0	1	2016 Bowman Platinum Ice Yu Darvish #45 Card Texas Rangers In Nm condition pack fresh Card
529	New Unisex Converse Women's 11/Men's 9	1	Men/Shoes/Fashion Sneakers	Converse	41.0	0	New black and white converse style Cyphe ox. Men size 9. Women's size 11. Box not included to save on shipping.
530	Michael Kors	2	Handmade/Bags and Purses/Purse		79.0	0	Small white Michael Kors Selma purse. Gorgeous bright white, perfect for traveling, going out, or just day to day use. Only used twice! No flaws.
531	Bali warmer	1	Home/Home Décor/Home Fragrance	Scentsy	39.0	0	"Brand new ""Bali"" 3pc warmer, comes with a bar to get you started :) absolutely beautiful warmer!"
532	Double Wreath Holder	1	Home/Home Décor/Home Décor Accents		7.0	0	Double Wreath Holder! Black metal. New condition! Great for wreaths, hanging baskets, signs & hanging decorations! Use on bathroom or bedroom doors with a wreath on the outside and a robe or towel on the inside!! I have 5 available for [rm] each. Bundle multiple items for a better deal!
533	PILATEN blackhead remover,60 ML	1	Beauty/Skin Care/Face		7.0	1	PILATEN blackhead remover,60 ML
534	2 VICTORIA SECRET LOGO BOY SHORT PANTY L	1	Women/Underwear/Panties	Victoria's Secret	17.0	1	2 pairs Free shipping New size large
535	Jordan boys outfit size 3	1	Kids/Boys 2T-5T/Tops & T-Shirts	Nike	17.0	1	No description yet
536	Pick any 5 NEW Disney DVDs out of 24	1	Electronics/Media/DVD		36.0	1	Pick any 5 NEW Disney DVDs out of 24 Toy Story 1 Toy story 2 Toy story 3 The Incredibles The Lion King The Lion King 2 The Lion King 1 1/2 The Princess and the frog Cars Cars 2 Hotel Transylvania The little Mermaid Rio Ice Age Beauty & the Beast Ratatouille Aladdin Mulan A bug's life Inside out The Lego movie Monsters Inc Monsters university James and the giant peach Moana (sold out) DVD lot, movie lot, movies, dvds, Disney Movies, family movies, kids movies, Disney dvds,
537	Rae Dunn You Are My Sunshine Mug	1	Home/Kitchen & Dining/Coffee & Tea Accessories	Rae Dunn	33.0	0	Brand new! Experienced and quick shipper!
538	Tender is the Night paperback. Brand new	1	Other/Books/Literature & Fiction		9.0	0	"My daughter was supposed to read this F. Scott Fitzgerald ""classic"" for school. After I ordered it, and couldn't find it any cheaper than [rm] since it's a ""classic"", she went with a different book. Has never been read. Is in perfect, brand new condition."
539	Beauty bundle color pop, bare Minerals	2	Beauty/Makeup/Face	ColourPop Cosmetics	15.0	0	Brand new unopened in perfect conditon all never used. Color pop ultra satin lip mini, bare minerals full size lash domination mascara, bare minerals mini lipstick in shade make your move moxie, bare minerals deluxe mini original powder foundation in medium beige, make up forever hd foundation sample from sephora, theBalm blush in shade hot mama, it cosmetics superhero mascara, Elizabeth mott matte bronzer, Temptu facial primer mini, full sized crayon concealer in shade light 2, mannakadar beauty blush in shade paradise blush, h&m eyeshadow in shade Dover, Hikari full size mascara, mini perfumes miss Dior, Chloe, and tom ford in orchard soleil, two mini Jane iredale lip & cheek stain in shade just kissed, TheBalm mad lash mascara mini. 19 pieces total Great Deal!! This is a steal! Plus 4$ Shipping! All brand name items! Mix of full size items, deluxe mini items, and mini items!
540	Vs pink vneck campus tee	2	Women/Tops & Blouses/T-Shirts	PINK	20.0	1	Size xs, oversized fit, worn once ,great condition.
541	Sweetie bell pony toy	3	Kids/Toys/Action Figures & Statues	My Little Pony	12.0	0	This toy is in good conditions might have a little black spots but is very clean is fun to play with and you can do any hairstyle you want she is a unicorn
542	NWT Lularoe Tween Thunder Storm Leggings	1	Women/Athletic Apparel/Pants, Tights, Leggings		40.0	1	Brand New! Only removed from packaging for photos. Made in Vietnam.
543	Burberry Small Canterbury Horseshoe Tote	1	Women/Women's Handbags/Totes & Shoppers	Burberry	506.0	0	"RETAILS: [rm],250.00 Just the right size to take you from work to weekend, this classic Burberry tote boasts canvas side panels printed with the British house's signature check in a nod to its rich heritage. Leather; lining: cotton Imported Double handles Interior tab with magnetic closure and clasp closure Interior zip pocket, two interior slip pockets, interior cell phone pocket Fully lined 16""L x 6.5""W x 10.5""H; 12"" handle drop"
544	Real Techniques Brush Lot	3	Beauty/Tools & Accessories/Makeup Brushes & Tools		25.0	1	Selling as a set, will not seperate unless offer is decent. Everything pictured is included. All are in great condition purchased at the end of last year. Some has been washed some still need to be I still suggest washing before use! Included are: Blush brush Buffing brush Expert face brush Contour brush Detailer brush Brow brush Deluxe crease brush Accent brush Base shadow brush Fine liner brush
545	New True Religion outfit size 6 months	1	Kids/Girls 0-24 Mos/Bottoms		34.0	0	New Authentic True Religion outfit. Price is firm
546	Ring	3	Women/Jewelry/Rings		95.0	1	Diamond ring. Stamped10k weighing approximately 2.6 grams. This is definately a dainty ring and is approximately a little under a size 8. Another blow out special snatched it up while you can. This has been cut in half. Don't wait to long there are nine people that have liked it. This is a steal just in case you don't know that already.
547	Genuine fur coat	3	Women/Coats & Jackets/Peacoat		24.0	0	No size . Feel like L
548	NWT The North Face Women's Tundra FZ	1	Women/Sweaters/Full Zip	The North Face	51.0	0	Brand new Women's 100 Tundra Full Zip fleece in XXL in dramatic plum color. Price is firm.
549	PINK Americana tshirt	2	Women/Tops & Blouses/T-Shirts	PINK	16.0	0	Slightly oversized fitting. Worn 1x. No flaws
550	Nike set NWT. M	1	Women/Athletic Apparel/Other	Nike	39.0	0	Medium in women's (⚡️⚡️I have a lot of Nike deals, visit my closet ⚡️⚡️)
551	4 Papermate Pencils 0.7mm	1	Other/Office supplies/School Supplies	Paper Mate	8.0	1	Price is firm. [rm] +[rm] shipping. Brand new. 2 ounces Thanks for looking.
552	Supreme Script Beanie FW 2016	2	Men/Men's Accessories/Hats	Supreme	36.0	0	I bought this during the Fall/Winter 2016 Collection. purchased straight off of the supreme website. it's only been worn a couple times. still super clean. looks brand new. it's a New Era brand OSFA.
553	Winter bundle	2	Kids/Girls 0-24 Mos/One-Pieces	Old Navy	8.0	0	Shirt 0-3 month leggings 6 months old navy and carters
554	Samsung On5 dual tech hybrid case	1	Electronics/Cell Phones & Accessories/Cell Phone Accessories		8.0	0	Wholesale to the public
555	LuLaRoe OS Leggings	3	Women/Athletic Apparel/Pants, Tights, Leggings		17.0	0	LuLaRoe OS Leggings made in China. VGUC I bought used but never wore. Close up pictures included for condition. Made in China. Blue, red, yellow colors in pattern.
556	New Nike Benassi JDI	1	Men/Shoes/Sandals	Nike	26.0	0	New Nike Men's Benassi JDI Slide - size- 12 Because of the size the shipping have to be [rm] ***** PRICE IS FIRM ***** *****NO FREE SHIPPING ****
557	Tommy girl	3	Beauty/Fragrance/Women		13.0	0	Tommy girl. 1.0fl oz. Top part missing. Barely sprayed
558	Sperry Top-Sider Boat shoes size 7.5M	2	Women/Shoes/Loafers & Slip-Ons		36.0	0	These are a pair of Women's Sperry Top-Sider Angel Fish Slip-On Shoes Size 7.5. They are in excellent condition! They were only worn once! Thanks for looking!  Smoke free home, make a reasonable offer.
559	Nike Shox size 2c	3	Kids/Girls 0-24 Mos/Shoes	Nike	12.0	0	Girls Nike Shox size 2c EEUC, no noticeable flaws
560	TWO TODDLERS TWO PIECE SETS	3	Kids/Girls 2T-5T/Other	Disney	14.0	0	TWO TODDLE OUTFITS
561	V-neck Tshirts Bundle	3	Women/Sweaters/V-Neck		10.0	0	3 v-neckd are included in this bundle. The 3 colors include light pink, light blue, and coral. 2 of the vnecks are from Gap whereas the light pink vneck is from Abercrombie Fitch.
562	Banned 1s	1	Men/Shoes/Fashion Sneakers	Air Jordan	271.0	0	Size 11 DS Receipt is available
563	Polo ralph lauren	2	Men/Tops/Polo, Rugby	Polo Ralph Lauren	28.0	0	Hoodie
564	Colorful Notebooks 6 pack bundle	1	Other/Office supplies/School Supplies		12.0	0	"6 pack bundle 150 sheets ""Fat Book"""
565	The Wolf Man #114 Funko ON HOLD	1	Kids/Toys/Action Figures & Statues	Funko	22.0	1	Monsters - The Wolf Man #114 Funko pop! *TOY TOKYO EXCLUSIVE* *GLOWS IN THE DARK*
566	Black Forever21 Heels	2	Women/Shoes/Pumps	FOREVER 21	14.0	1	Black, Size US 7, Worn 1x
567	Vintage Nambe 562 1960's	3	Vintage & Collectibles/Antique/Collectibles		19.0	0	2 different sizes vintage Nambe bowls!
568	CHANEL Well Loved Brush Bundle! Authenti	3	Beauty/Tools & Accessories/Makeup Brushes & Tools	Chanel	30.0	1	Well loved Chanel brush bundle. I used these for artisry many years ago. There are 9 brushes total and are still in great shape. I gurantee authenticity as I purchased these one by one :-) #chanel #brushset #authentic #chanelbrushes
569	AirOptix Blue pair of contacts	1	Beauty/Makeup/Eyes		6.0	1	One pair (2 lenses) Plano lenses NO RX (used for color NOT vision) Color Blue Free shipping *ships Monday**
570	American Girl Books	3	Other/Books/Children's Books		26.0	0	Set of 13 books. Great condition! Retail value [rm]. The care and keeping of you *How to Win friends and influence people for teen girls * A smart girls guide to sticky situations * A smart girls guide to boys * A smart girls guide to starting middle school * stand up for yourself and your friends * hair * true stories * quiz book * to do today * the misadventure of American girl * ****staying home alone ****** ****math smarts ****** The last two books have some writing in then. Basically check marks when answering surveys. The other books look almost brand new. Spines not broken.
571	High Waisted Denim Distress Shorts	2	Women/Jeans/Other	Buffalo David Bitton	10.0	1	NWOT: High waisted denim shorts with rips in the front.
572	Original Brand New Adidas nmdr	1	Women/Shoes/Athletic	adidas Originals	140.0	1	Brand new inbox Adidas nmdr Sneakers available in different sizes. Inbox for your size.
573	Soda Streams	1	Home/Kitchen & Dining/Small Appliances		40.0	1	More than one available to buy/ Brand new never opened unused. Soda stream source starter kit features Easy Snap - Lock bottle insertion Limited lifetime warranty Home Soda Maker
574	Adult mouth guard1 black and 1 clear	1	Sports & Outdoors/Team Sports/Football		9.0	1	Protect teeth during sports or sleeping
575	Women's Green tshirt	2	Women/Tops & Blouses/T-Shirts		10.0	0	Nice dark green tshirt. Size medium.
576	OFRA BEVERLY HILLS HIGHLIGHTER	1	Beauty/Makeup/Makeup Palettes	Sephora	19.0	1	Swatched Full size
577	Jagger	2	Women/Shoes/Boots		16.0	0	Black Riding boots Great for the winter Only worn a couple of times; still in great condition Size 7
578	Summer Dress	3	Women/Dresses/Above Knee, Mini		10.0	1	Soft and light black/gray/white summer dress. Perfect for the beach! Offers are welcomed!
579	Outre Neesha Lace Front Wig Color DR30	2	Women/Women's Accessories/Hair Accessories		23.0	1	No description yet
580	Loeffler Randall Envelope Clutch	2	Women/Women's Accessories/Wallets	Loeffler Randall	33.0	1	This clutch is made of python embossed leather. New and unused - [rm] value
581	Spanish for Everyone NDS	2	Electronics/Video Games & Consoles/Games	Nintendo	9.0	0	Great little game that keeps your mind sharp. Has lots of things to do while you learn Spanish. It comes with the instruction book also.
582	iPhone 6/6s plus cases	3	Electronics/Cell Phones & Accessories/Cases, Covers & Skins	Apple	20.0	1	4 iPhone 6/6s plus cases.
583	Tommy Hilfiger	3	Men/Shorts/Casual Shorts	Tommy Hilfiger	10.0	0	size 30
584	J. Crew Military Green rolled sleeve tee	1	Women/Tops & Blouses/T-Shirts	J. Crew	9.0	1	NWT. Has split side detailing and rolled sleeves. Brand new, comes from smoke/pet free home.
585	Mens Plaid Button Up Shirt	1	Men/Tops/Button-Front	George	6.0	1	Never worn. Still has original tags. Comes from a pet free, smoke free home.
586	Blue Adidas Size 11 Men's	1	Men/Shoes/Athletic	Adidas	45.0	0	Purchase off of here for my boyfriend but he can't for them :( So I'm selling them
587	FINAL PRICE! Nikon Coolpix L830	3	Electronics/Cameras & Photography/Digital Cameras		106.0	0	A Nikon Coolpix L830 digital camera. It comes with the camera strap, the lens cap, the lens cap cord, the manual, and a 4 gb SD card. This is a point-and-shoot camera, not a DSLR, but I've taken some nice photos on it. It's 16 mp and has 34 x optical zoom. The camera is in perfect condition. I originally purchased this for about [rm], so NO LOWBALL OFFERS. No, I cannot offer free shipping. PRICE JUST LOWERED CONSIDERABLY! FINAL PRICE! NO LOWER!
588	Dose Of Colors Eyes Cream Palette	3	Beauty/Makeup/Eyes		18.0	1	Comes with protective slip. Used. Nothing has hit pan.
589	Honey & Spice ▪️New Fall Scent!	1	Beauty/Fragrance/Candles & Home Scents		3.0	1	"Try a NEW FALL scent of Pink Zebra Sprinkles soft soy wax melts!! ▪️ Sprinkle bag is 2""x3"" and contains (1) heaping tablespoon size scoop equal to (3/4 oz) of scent. See pic #2 for size comparison of a Pink Zebra Sprinkles scoop. See photos for more information Can be used in any brand electric wax warmer. These sprinkles are highly concentrated so a little bit goes a long way!! ▪️️Please note - Summer is here & the weather is heating up. These are made of soft soy wax and extreme heat from the sun can cause these to lose their pebble shape however, they will still offer their amazing fragrance in your warmer! Please check your mail & remove from mailbox as soon as possible."
590	Lularoe OS Butterflies	1	Women/Athletic Apparel/Pants, Tights, Leggings		30.0	1	Brand new with tag. Made in Vietnam
591	Under Armour black compression shirt	1	Men/Athletic Apparel/Shirts & Tops	Under Armour	13.0	1	Brand new with tags. Small barely noticeable defect on side stitching (see last picture)
592	Masters Visor Hat	2	Men/Men's Accessories/Hats	Masters	21.0	0	+ Masters Visor Hat + Official Masters Item + Hat is in great condition + Adjustable Hat ⛳️
