train_id	name	item_condition_id	category_name	brand_name	price	shipping	item_description
708	NIB AVEDA TRIPLE ACCENT IN OLIVE/QUINCE	1	Beauty/Makeup/Eyes	Aveda	10.0	1	New in box, Aveda triple accent in 136 olive/quince from the petal essence line. Eye color is a gorgeous smudgeable olive green and the cheek/lip color is a soft coral orange color. This has never been used or swatched. I purchased an extra and never got around to using it.
709	FREE SHIP BBW Lotion Tahiti Island Dream	2	Beauty/Skin Care/Body	Bath & Body Works	6.0	1	Bottle is still full. Only used once.
710	Vintage GE transistor Radio	3	Vintage & Collectibles/Electronics/Radio	General Electric	18.0	0	Runs great
711	Fairy Tales Lice Prevent Condition Spray	1	Beauty/Hair Care/Conditioners		12.0	0	Brand New Fairy Tales Lice Prevention Conditioning Spray
712	Bare Minerals Ready Face Color Palette	3	Beauty/Makeup/Face	Bare Escentuals	10.0	1	Bare Minerals Ready Face Color Palette in The Good Vibes, authentic, used once, what you see is what you get, as pictured, see photos for usage, sprayed with isopropyl alcohol for disinfection purposes. Shades include: The Pick Me Up The Ocean View True
713	Ralph Lauren pj sleeper boy 3M	1	Kids/Boys 0-24 Mos/One-Pieces	Ralph Lauren	13.0	1	Size 3 months baby boy navy Ralph Lauren Layette sleeper, snap pj. Cuffed hands to protect baby from scratching face. Such soft warm cotton! New Smoke free home!
714	Mary Kay Lipstick- Red Salsa	1	Beauty/Makeup/Lips	Mary Kay	8.0	1	No box
715	USC Cheerleader Outfit 12 months	2	Kids/Girls 0-24 Mos/Dresses		14.0	0	No description yet
716	(36D) FS! victoria secret bra	2	Women/Underwear/Bras	Victoria's Secret	25.0	1	Victoria secret very sexy push up front close snap, adjustable strappy back 36 d bra. Bra is in like new condition. No stains or tears. Pet free smoke free home. Price is firm. **like something else in my closet, ask to bundle to save a few $$**
717	Merc Scentsy Koala	1	Home/Home Décor/Home Fragrance	Scentsy	25.0	1	No description yet
718	2 Cute Ring Size 8	2	Women/Jewelry/Rings	Stamped	34.0	0	New with tag. S925 sterling silver stamped. Similar style to Pandora.
719	Set of 4 skull underwear	2	Women/Underwear/Panties		10.0	0	Brand new, never worn just washed. Came in a package of 5, but I wore one and realized not my size!
720	Lularoe elegant Irma	1	Women/Tops & Blouses/Tunic	Independent	39.0	0	BNWT Size medium Gorgeous silver from the limited elegant collection.
721	Country Decor	1	Home/Home Décor/Home Décor Accents		8.0	1	"Wooden country candles with wick. These are wooden. Burgundy is 7"" tall, navy is 5"" and beige is 3"" tall."
722	Flat Shoes	1	Women/Shoes/Flats		16.0	0	Brand New Call It Spring Size 8 women
723	Brow Wiz	1	Beauty/Makeup/Eyes	Anastasia Beverly Hills	16.0	0	Auburn
724	Lularoe Halloween OS BN china	1	Women/Athletic Apparel/Pants, Tights, Leggings		20.0	1	Bought way too many and would like to get rid of my least favorite ones. Brand new. Just took out of the package to take a picture. If you purchase before 4pm it will ship the same day!
725	New England Patriots Shirt	3	Sports & Outdoors/Fan Shop/NFL		9.0	0	Size medium
726	Baby Polo Button-up	3	Kids/Boys 0-24 Mos/Tops & T-Shirts	Ralph Lauren	8.0	1	Baby boy Polo shirt. Buttons on the sleeves so that it can be worn as a shorter sleeve shirt or long-sleeved. Horse is navy blue, and the plaid colors are blue, green, yellow and pink. Gently used.
727	3 - Pampers Size 3	1	Kids/Diapering/Disposable Diapers		24.0	0	3 - Pampers Size 3 New & sealed
728	Grateful dead bears beach towel	1	Women/Swimwear/Beach Accessories		22.0	1	Brand new
729	FREE SHIP unicorn Lularoe cassie Skirt	1	Women/Skirts/Straight, Pencil	Independent	35.0	1	new lularoe cassie houndstooth skirt xl. with tags. pet free smoke free home. black and white with tags.
730	NEW••AUTHENTIC YETI BUNDLE	1	Other/Other/Other		44.0	1	New never used. Retails at [rm] each. 100% authentic. Free shipping included. Willing to separate if need be.
731	Gray Sweater size S	3	Women/Sweaters/Crewneck	Old Navy	14.0	0	Small side slits, shoulders have a slightly different pattern that is a little sheer. The rest is not sheer at all. No flaws. Size XS but fits like a S.
732	Men underwear	1	Men/Other/Other		11.0	1	White men fishnet under wear Men white fishnet underwear. Size 32-34 M
733	Bundle for bluebird310	2	Home/Bath/Bathroom Accessories	Bath & Body Works	25.0	0	BBW showergels and Yankee candle plug-ins
734	Ugg Toddler Chestnut	1	Kids/Girls 2T-5T/Shoes	UGG Australia	65.0	1	FREE AND FAST SHIPPING!!! Brand-new chestnut UGGs in toddler sizes. Normal retail price is [rm]. Available in sizes 10 and 11.
735	Hollister Top	2	Women/Tops & Blouses/T-Shirts	Hollister Co.	5.0	1	Off the shoulder top Floral design Soft material Like new
736	ASICS Volleyball shoes	3	Women/Shoes/Athletic	ASICS	26.0	0	Black and grey athletic shoes, only flaws are a few minor seam ends coming loose, otherwise they are like new Women's size 7
737	Rae Dunn oval plates (hold for Melissa)	1	Vintage & Collectibles/Housewares/Ceramic		36.0	0	4 oval plates, each with a different saying.on each Set of 4 for [rm], or [rm] each
738	Boy's H&M Hooded Puffer Jacket Coat Navy	3	Kids/Boys (4+)/Coats & Jackets	Gap	14.0	0	Zip(s)-up Contrast Gray/Grey/Blue Detailing Silver
739	Sperrys loafers	3	Women/Shoes/Loafers & Slip-Ons		16.0	0	Sperrys worn a couple times Fits like a 6.5-7 Excellent condition
740	Women's bomber jacket size small	3	Women/Coats & Jackets/Other	FOREVER 21	17.0	1	Super cute color women's forever 21 bomber jacket its that pinkish colored with silver zippers Size small Only wore a few times in great condition
741	Simply Southern Long sleeve T-shirt	2	Women/Tops & Blouses/T-Shirts	Simply Southern	14.0	0	Only worn about twice, no stains or rips.
742	iPad Pro Smart Cover	2	Electronics/Computers & Tablets/iPad/Tablet/eBook Readers		31.0	0	iPad Pro Smart Cover in Lilac Made for iPad Pro - 9.7 inch Polyurethane Cover magnetically aligns itself. Open or close to wake or sleep iPad.
743	Sales! ❤ ship out today! Logo Boyshorts	1	Women/Underwear/Panties	PINK	11.0	1	Price is included a shipping cost first class mail / 2-7 days Brand new with tag or online package Victoria Secret Pink Logo Boyshorts Medium size Begonia Price firm, bundle for discount
744	Adidas shoes- for Elizabeth	3	Men/Shoes/Athletic	Adidas	15.0	0	No description yet
745	Victoria's Secret panty bundle	1	Women/Underwear/Panties	Victoria's Secret	15.0	1	Brand new in package, size large logo low rise hipster panty, front is white with hot pink lips and the back is black with hot pink lips. 2 pairs-- hot pink lips and white and orange stripped.
746	John deere toys	2	Vintage & Collectibles/Antique/Collectibles		20.0	0	No description yet
747	Sakura pens	1	Other/Office supplies/School Supplies		10.0	1	Price is firm! Set of 6 Brand new in package Pigma Manga comic pro Black pen markers + one mechanical pens
748	Little people farm	1	Kids/Toys/Baby & Toddler Toys	Fisher-Price	34.0	0	Little people animal friends farm sounds.songs and matching play 1-5 year old
749	It cosmetics light celebration foundatio	3	Beauty/Makeup/Face		12.0	1	100% authentic see lot numbers Full size and authentic Used see pictures
750	GARANIMALS 2T FLEECE ZIP UP 2 PIECE	3	Kids/Girls 2T-5T/Other		8.0	1	EUC GARANIMALS 2T FLEECE ZIP UP HOODIE AND SWEAT PANTS IN GREAT SHAPE LIKE NEW! FREE SHIPPING
751	1st Birthday Boy Party Bundle	1	Kids/Toys/Party Supplies		16.0	0	Have a 1st Birthday boy party bundle including 20 pieces! Some stuff used like decoations and other stuff unopened. 2 happy birthday banners. 6 hanging decorations. 1 high chair decorating kit 2 pks 8ct thank you cards. 1 pk 8ct invitations. 1 pk 12ct blue cups. Birthday confetti. 1pk 20ct blue desert plates. 2 pks 20ct green leaf plates. 1pk 2 ct centerpieces 1 Birthday boy party hat and 1 bib
752	Tween Lularoe Flowers	3	Women/Athletic Apparel/Pants, Tights, Leggings	LuLaRoe	9.0	0	Wear on the butt (shown in picture) black with forest flower design. Tween. Retail for 25
753	Skirt	3	Women/Skirts/Asymmetrical		9.0	0	Size 12
754	H&M Bikini	3	Women/Swimwear/Two-Piece	H&M	18.0	1	H&M padded bra red bikini. Bottom is a medium and top is a small.
755	GoPro HERO + BUNDLE OF EXTRAS!	2	Electronics/Cameras & Photography/Camera & Photo Accessories		120.0	1	For sale, I have a GoPro HERO + LCD Waterproof Action Cam HD Camera Camcorder + BUNDLE OF EXTRAS! Below is a listing of everything included: -GoPro HERO in waterproof housing - 6 different clip mounts -8 different screw nobs with 2 different lengths -wrist mount with strap -EXTRA wrist strap -Flotation handle with strap -Suction cup mount -8 adhesive mounts -carrying case (black) -charging cable -miscellaneous mounts** Reasonable offers only!
756	Kylie Holiday Palette | Kyshadow	1	Beauty/Makeup/Makeup Palettes		25.0	1	Kylie Holiday Palette | Kyshadow Kylie Cosmetics Holiday Edition  Brand New Fast and Free Shipping
757	iPod nano 7th generation	3	Electronics/TV, Audio & Surveillance/Portable Audio & Accessories	Apple	62.0	1	In perfect working condition. One light scratch on the back, the front and screen are absolutely flawless. Comes with original USB cable, no wall port or headphones. Price is firm.
758	Strapless Maxi Dress NWT	1	Women/Dresses/Full-Length	MSK	19.0	0	Animal print Size 8 Strapless full length Has sewn in padding and ties around waist. Originally [rm], paid [rm], selling for [rm] (never worn)
759	Harry Potter PC game free shipping	3	Electronics/Video Games & Consoles/Games	Microsoft	6.0	1	Works great Fast shipping with tracking Weighs 6 oz so free shipping
760	Pure Romance Ben Wa Balls	1	Other/Daily & Travel items/Personal Care		12.0	1	No description yet
761	Mauve ice lipsense free ship	1	Beauty/Makeup/Lips	SeneGence	22.0	1	Brand new sealed tube!
762	Pandora bracelet	1	Women/Jewelry/Bracelets	PANDORA	18.0	1	Brand new Pandora bracelet signature makings ALE 925
763	Fine Mink Eyelashes 3 pair	1	Beauty/Makeup/Eyes		15.0	1	3 pair bundle Fine soft mink Comfortable lashband
764	Jeffree Star Cosmetics Liquid Lipstick	1	Beauty/Makeup/Lips	Jeffree Star Cosmetics	15.0	1	shade queen bee, not sold anymore. 100% authentic purchased at beautylish.
765	iPhone 6/6s otter box	3	Electronics/Cell Phones & Accessories/Cases, Covers & Skins		11.0	0	Otter box in decent shape, has some scuffs and scratches on it but will do the job.
766	Louis Vuitton wallet	2	Women/Women's Accessories/Wallets	Louis Vuitton	15.0	0	Not used it was a gift, great condition
767	Women's Columbia Jacket	2	Women/Coats & Jackets/Fleece Jacket	Columbia	20.0	1	color : blue size : women's medium condition : never been worn, very good condition
768	Sale! [rm] For 2 morphe brushes	1	Beauty/Tools & Accessories/Makeup Brushes & Tools		12.0	1	New
769	Free ship Coach red purse	3	Handmade/Bags and Purses/Purse		37.0	1	Free shipping Authethic Coach red purse with brown handle and lining.
770	New Vera Bradley Parisian Paisley Bundle	1	Women/Other/Other	Vera Bradley	30.0	0	NWT Vera Bradley Kiss lock Case and Luggage Tag and Double Eye Glass Case in Parisian Paisley. Bundle.
771	Koala Baby 0-3 Month Baby Boy Outfit	2	Kids/Boys 0-24 Mos/Tops & T-Shirts		8.0	1	This is an adorable dressy baby boy holiday outfit from Koala Baby Boutique! The size 3 month set includes a long sleeve while button down collared shirt with a removable bow tie, speckled black dress pants, and a cute brown argyle sweater vest! The outfit is in perfect condition, would be great for the Christmas holidays, and comes from a smoke free home! • PRELOVED • BUNDLE TO SAVE [rm]+[rm] OR [rm]+free ship
772	"Nike Meadow ""16 TXT NEW. (8.5)"	1	Women/Shoes/Athletic	Nike	44.0	0	Size 8.5 women's new without box (box no lid) ✅FIRM PRICE NO FREE SHIPPING (⚡️I have a lot of Nike deals, visit my closet ⚡️)
773	New Aviator Tula Blanket	1	Handmade/Children/Baby		55.0	1	New in bag, never unrolled!
774	Lularoe kids sm/med octopus	1	Kids/Girls 2T-5T/Bottoms		39.0	1	Sooo cute
775	Marisol Lot HOLD APPLE	2	Kids/Toys/Dolls & Accessories	American Boy & Girl	29.0	0	Theater case/ Trunk with box.
776	Wildfox no love no backstage pass hoodie	3	Women/Sweaters/Hooded	Wildfox Couture	116.0	0	Very cute very old Wildfox zip up with a hood… Oversized almost like a men's small
777	The Ultimate L.B.D.	1	Women/Dresses/Above Knee, Mini	Bebe	31.0	0	Black mini with gold zipper detail and never worn.
778	Creme to powder foundation	1	Beauty/Makeup/Face	Mary Kay	14.0	1	.35 oz. Endless Performance® Crème-to-Powder Foundation is your key to a long-lasting, flawless finish. Stays true and appears fresh for 12 hours.* Heat- and humidity-resistant. Glides on as a lightweight cream to hide imperfections. Evens out skin tone, then dries to a soft, powdery, matte finish. Transfer-resistant. Won’t rub off or streak. COLOR: beige 4
779	NWT bath towel	1	Home/Bath/Towels		12.0	0	NWT K & C wearable bath towel. No rips, stains or flaws. Smoke-free home. Has velcro closure and adjustable straps! 100% polyester. #towel, #pink, #teal Krislyn
780	Kate spade purse like new	2	Women/Women's Handbags/Messenger & Crossbody	Kate Spade	75.0	1	Received in like new condition and still havent used it. It is to beautiful to just set around. Kate Spade Wellesley Small Rachelle Satchel Bag Mint Mojito Green
781	Black Nike Size 5 C	3	Kids/Boys 2T-5T/Shoes	Nike	18.0	0	Black Nike ACG Boots Size 5C in great condition. Price drop and price is firm final price no free shipping. Tags: Nike boots size 5C boys Nike 5C Black Nike baby boy size 5C boy's Nike size 5C
782	Better than false lashes too faced	1	Beauty/Makeup/Eyes	Too Faced	17.0	1	Still in box, 100% authentic
783	Clarks Bendables Mary Jane Wedges	2	Women/Shoes/Pumps		22.0	1	"Clarks Bendables Size: 6.5 Heel height: 2"" Heel type: wedges Light scuffing on the heels Does not come with original box"
784	ABH modern renaissance palette	1	Beauty/Makeup/Makeup Palettes		43.0	1	Brand new Authentic Price is firm Anastasia beverly hills modern renaissance palette
785	HOLD - HakunaMatata - Aero Ombré Legging	3	Women/Athletic Apparel/Pants, Tights, Leggings	Aeropostale	10.0	1	Aeropostale brand | Size: XL | Cotton blend | Legging style | Full length | Fold over band is blue and white ombré (pic is a little light) | Live Love Dream in studs on back of band | Zero flaws | Tags: #aeropostale #yogaleggings
786	1 Contours Palette and Sponge	1	Beauty/Tools & Accessories/Makeup Brushes & Tools		9.0	0	Bundle 15 Colors Contours Face Cream Makeup Concealer Palette + 1 Sponges Brand new in package. Description: Material: Foundation cream Box size: approx 15 x 10 x 1.3 cm / 5.91 x 3.94 x 0.51 inch Made of excellent material, safe and soft for your facial skin Combines 15 colors in one palette, can be mixed to help create different looks Used as foundation primer, foundation, concealer, camouflage and eyeshadow base Great for shading, light weight but wearable. It's great for highlight and contouring for beginners
787	2 brand new dolman style tops xl/2xl	1	Women/Tops & Blouses/Blouse		20.0	1	Brand new dolman tops super soft. One is black the other is red. Smoke free home. Taken out to try on and take pictures. They were too big for me. I wear a size large lularoe irma and these were just too big. They are size 1x-2x.
788	Harry Styles Magazine	1	Other/Magazines/Lifestyle & Cultures		10.0	0	Brand new Harry styles magazine in great condition. [rm] + [rm] shipping OBO
789	Converse Chuck Taylor NAVY BLUE	3	Men/Shoes/Fashion Sneakers	Converse	16.0	0	Used a few times in great condition but need to be cleaned. SIZE 12 in women's Box not included Converse
790	Fashion jewerly	2	Women/Jewelry/Necklaces	Vintage	19.0	0	Neckless and ear rings brand new never used
791	Lilly & Kate Mug , Purse & Stopper	1	Home/Kitchen & Dining/Coffee & Tea Accessories	Lilly Pulitzer	60.0	0	Lilly Pulitzer Mug And Gift Box new! Kate spade mug Waterford crystal wine stopper Longchamp small handbag
792	FREESHIP Rae Dunn LATTE mug	1	Home/Kitchen & Dining/Coffee & Tea Accessories		22.0	1	New, unused Rae Dunn LATTE mug. Please review photos as you will receive exact mug pictured. Packaged with care.
793	namaste in bed tee shirt	1	Women/Tops & Blouses/T-Shirts	Lululemon	10.0	0	relaxed size large namaste in bed tee! perfect for lounging around or even put it with a cute sweater and scarf for the fall!
794	Zip/button up jacket	3	Women/Coats & Jackets/Military	Express	28.0	0	Super cute! In used but good condition! You can zip it up or button! Decently thick material, good for the spring or fall! And you can dress it up or down! Says size 1X but would fit a large. I usually wear a 12-14 and this is over sized on me (as pictured)
795	Free ship! (6/7) Victoria's Secret Pink	3	Women/Shoes/Slippers	PINK	24.0	1	These slipper boots have a button missing, as seen in photo 2. Also there was a small hole that I fixed as seen in photo 3 has bondex on the inside so the stitching doesn't come undone. Not even noticeable. The bottoms are a little dirty as seen in photo 4. Says size 7-8 but fits like a 6-7. Mukluk like slippers.
796	iPhone 4	3	Electronics/Cell Phones & Accessories/Cell Phones & Smartphones	Apple	30.0	1	Black iPhone 4 for Verizon comes with charger
797	Baby boy woody outfit n notepads	1	Kids/Boys 0-24 Mos/One-Pieces	Disney	10.0	0	Disney woody outfit 6-9 months New with tags 10 packs note tabs I do bundles. Let me know so you can save on shipping.
798	Black sparkly stretchy turtleneck	3	Women/Sweaters/Turtleneck, Mock	Express	12.0	0	Black turtleneck with subtle sparkly silver thread. Size medium and easily stretches.
799	FREESHIP LG tones pro pink	1	Electronics/Cell Phones & Accessories/Headsets	LG	25.0	1	Tried once and didn't like the fit and forgot to return. My loss your gain Also works as bluetooth phone calls as well as music Wireless
800	Chicken painting framed	3	Home/Artwork/Paintings		11.0	0	"Great condition frames chicken painting. I'd say maybe 9"" x 9"""
801	Oshkosh 3T lacy ivory top	1	Kids/Girls 2T-5T/Tops & T-Shirts	Osh Kosh B'gosh	8.0	0	New with tags from genuine kids by Oshkosh… size 3 toddler. Camel colored short sleeve top with lacy overlay. Lined. From a smoke smoke and pet free home. This was received as a Christmas gift, and my daughter got the same shirt twice. Super cute and versatile
802	Thrasher shirt (authentic)	3	Women/Tops & Blouses/T-Shirts	Thrasher Magazine	24.0	0	Don't wear it anymore, minor flaw is stain, not really noticeable and can possibly come out in the wash! No peeling on thrasher logo, COLOR IS NAVY CAN FIT A SMALL SHIRT IS UNISEX MAKE OFFERS
803	Funko Pop ALBUS DUMBLEDORE & HERMIONE	1	Vintage & Collectibles/Collectibles/Figurine		20.0	1	Harry Potter Set damage box
804	Stripper shoes	3	Women/Shoes/Pumps		16.0	0	White stripper shoes with diamond heels See photos for condition, some marks and need to be cleaned but otherwise good condition
805	Reserved For Angie Cupps	1	Home/Kitchen & Dining/Dining & Entertaining		21.0	0	One deee mug
806	4 stranger things funko pops	1	Vintage & Collectibles/Toy/Action Figure	Funko	100.0	0	Includes Chase and normal demogorgon And both eleven with eggos
807	Pantiliner bundle	1	Other/Daily & Travel items/Personal Care	Always	26.0	0	New in box/Unopened. 11 boxes of always radiant pantiliners. Regular/unscented. 54 per box *selling as a bundle* Retail: [rm]
808	18months Bundle baby clothes 200$ worth	1	Handmade/Children/Baby		90.0	0	Bundle baby clothes 200 dollars worth of clothes brand new with tag for 80 plus socks and baby spoons and plates everything has never been opened brand new with tags.
809	Levi's	2	Kids/Boys 0-24 Mos/Bottoms	Levi's®	10.0	1	Straight leg nwot
810	SHOPKINS stamp set	1	Kids/Toys/Dolls & Accessories	Moose Toys	5.0	1	New never used 4 piece set
811	Mens Timberland boots	4	Men/Shoes/Boots	Timberland	34.0	0	Slightly worn
812	Hayley Williams B&W Tripp Leather Jacket	3	Women/Athletic Apparel/Jackets	Tripp NYC	66.0	0	Gently used leather jacket. It's similar to the one Hayley Williams has (idk if it's the same exact brand). I originally bought this for myself but it's too small :/
813	Home decor	3	Home/Home Décor/Home Décor Accents	Home Interiors	7.0	0	I used it for my room door. I hung it there for a while but I'm changing the theme of my room so getting rid of it it has light scratches.
814	Too faced lip injection extreme	1	Beauty/Makeup/Lips	Too Faced	8.0	1	Sample size too faced lip injection
815	Kylie Birthday Mini Mattes	1	Beauty/Makeup/Lips		16.0	1	New. Free shipping! Authentic!
816	NWT Off Shoulder Blouse	1	Women/Tops & Blouses/Blouse		10.0	0	Brand new, never worn! Still in package. Navy Blue off shoulder blouse with cut out. Lightweight material. 3/4 length sleeve. Size Medium. Tags: Hollister, Daytrip, Buckle, Express, H&M, Urban Outfitters, American Eagle Smoke free home Ships same day or next day Offers through chat :)
817	Cute cat stickers	1	Home/Home Décor/Home Décor Accents		4.0	1	This is a bundle of two sets of cat stickers!! Very cute decor!
818	Boys Jordan Shirt & shorts	3	Kids/Boys (4+)/Top & T-shirts		11.0	0	Boys Jordan Dri-fit shirt with matching Jordan shorts with pockets; shirt size 7 shorts size 6/7; great condition
819	Fable 2 & 3	3	Electronics/Video Games & Consoles/Games	Xbox	21.0	0	Fable 2 & 3 for xbox360 Bundle to save more.... checkout my closet
820	Victoria secret bottle opener glasses	1	Women/Women's Accessories/Sunglasses	PINK	8.0	1	PERFECT FOR SPRING BREAK! The best summer gift Sea foam green NEVER USED
821	H&M one piece	1	Women/Swimwear/One-Piece	H&M	12.0	0	Brand new with tags Ties around neck With low cut back Size 14. Will fit a medium to XL very stretchy
822	Louis Vuitton box include dust bag	1	Women/Women's Accessories/Wallets	Louis Vuitton	39.0	0	Louis Vuitton wallet box with dust bag No flaws, This is my lowest NO FREE SHIPPING Did not use at all Authentic proof in the photo Wallet box (?) Clothdust bag is included Just the dust bag is [rm]. Which is listed in my page Size 14.8cm x 12.4cm x 4.4 cm Fits small wallet like the one is the picture or card case Long wallet doesn't fits !!
823	Brand new	1	Kids/Girls (4+)/Tops & T-Shirts	Justice	13.0	1	Justice brand new size 16
824	Pink north face vest	2	Women/Coats & Jackets/Vest	The North Face	34.0	0	Girls medium but fits women's small Hot pink The north face Zip up vest Goose down insulation NWOT
825	Adidas sweatpants	4	Men/Sweats & Hoodies/Track & Sweat Pants	Adidas	17.0	0	Adidas climalite all black sweatpants. They are in good condition but have some snags in them. The snags are mainly on the butt area and there are some on the front but no major ones that have caused a hole. Since the pants are all black the snags are barely noticeable. Message me for more details and offers
826	Nightmare Before Christmas Sally Tea Pot	1	Vintage & Collectibles/Toy/Action Figure		30.0	0	The Nightmare Before Christmas Sally with Cat 32 oz. Teapot is made from ceramic and measures 7 1/2-inches tall. The beautiful teapot finds Sally from Tim Burton’s The Nightmare Before Christmas with a small black cat standing atop her head.
827	Born This Way natural Beige	1	Beauty/Makeup/Face	Too Faced	32.0	0	Brand new unopened in box never used or swatched AUTHENTIC, check out my ratings I sell tons of too faced all Authentic Last pic shows serial numbers
828	Shiseido White / Blue Stripes Large Tote	1	Handmade/Bags and Purses/Tote		8.0	1	New! Shideido white/blue stripes large tote Nice to carry to beach Gwp from shiseido
829	Resident Evil 4 for Nintendo GameCube	2	Electronics/Video Games & Consoles/Games	Nintendo	13.0	1	Complete and in excellent overall condition
830	NWT Minecraft Legos	1	Kids/Toys/Building Toys	LEGO	24.0	0	Brand new 262 pcs Minecraft Lego set. The box is sealed. Price is FIRM. No Free Shipping
831	Hatchimals Wal-Mart Exclusive Burtle	1	Kids/Toys/Electronics for Kids	Spin Master	52.0	1	Brand New In Unopened Box
832	Small NWT Detroit Tigers fitted tee	1	Women/Tops & Blouses/T-Shirts		9.0	1	Size small NWT Detroit Tigers fitted tee. Brand new, never worn, tags attached. Is dark gray with orange glitter writing and Detroit logo on front. Is fitted, fits true to size.
833	Wet N Wild Highlighter Palette	3	Beauty/Makeup/Face	Wet n Wild	3.0	1	Only used like twice Don't need it anymore
834	3-6 Month Baby Clothes	3	Kids/Girls 0-24 Mos/One-Pieces	Carter's	39.0	0	10 pj's, 21 onsie's, 12 pants, 8 outfits, 7 tops, 1 bathrobe, 3 sweaters
835	AEROPASTALE L WHITE BUTTON DOWN	3	Men/Tops/Button-Front	Aeropostale	7.0	0	This shirt is very light and cute with a tank underneath it! Good condition no flaws, bundle and save
836	VS Pink bling campus crew XS	1	Women/Tops & Blouses/T-Shirts	PINK	26.0	0	New in bag!!! Pink Long sleeve campus tee Size XS Oversized Bling Retail [rm]
837	Vineyard vines long sleeve	3	Women/Tops & Blouses/T-Shirts	vineyard vines	26.0	1	Gorgeous light blue shirt, boys XL (or women's xs-s) only flaw is a slight discoloration on the front of the shirt, but it is hardly noticeable.
838	Girl's Apple bottom 3pc 18mth	3	Kids/Girls 0-24 Mos/Tops & T-Shirts		10.0	1	Great condition Apple bottom tag on tshirt was cut off doesn't affect the shirt (shirt is not ripped) Size 18 month
839	Navy or Tan Gucci Satchel	3	Women/Women's Handbags/Shoulder Bag	Gucci	120.0	1	Selling both together since they both have some issues, nothing major both bags can be used.
840	NEW Maybelline master contour stick	1	Beauty/Makeup/Face	Maybelline	10.0	0	SHADE IS medium 015
841	FREE SHIP button down top	3	Women/Tops & Blouses/Button Down Shirt		5.0	1	Great condition. 1/2 sleeves. Buttons in the back as well. Bundle for only [rm]
842	Pulitzer Dress	2	Women/Dresses/Knee-Length	Lilly Pulitzer	54.0	0	NWOT SIZE LARGE LILY PULITZER DRESS. Never worn.
843	Men's essentials	1	Men/Other/Other		9.0	0	Brand new never used
